============================= test session starts =============================
platform win32 -- Python 3.11.6, pytest-9.0.2, pluggy-1.6.0 -- C:\Users\rene_\AppData\Local\Programs\Python\Python311\python.exe
cachedir: .pytest_cache
rootdir: D:\CCC 2.0\AI\agent-governance-system\CATALYTIC-DPT
configfile: pytest.ini
plugins: anyio-4.12.0
collecting ... collected 225 items

CATALYTIC-DPT\TESTBENCH\spectrum\test_spectrum02_emission.py::test_spectrum02_emission PASSED [  0%]
CATALYTIC-DPT\TESTBENCH\spectrum\test_spectrum02_resume.py::test_spectrum02_resume PASSED [  0%]
CATALYTIC-DPT\TESTBENCH\spectrum\test_spectrum03_chain.py::test_spectrum03_chain PASSED [  1%]
CATALYTIC-DPT\TESTBENCH\spectrum\test_validator_version_integrity.py::test_validator_version_integrity PASSED [  1%]
CATALYTIC-DPT\TESTBENCH\test_adversarial_cas.py::test_cas_corruption_detected_by_hash_toolbelt PASSED [  2%]
CATALYTIC-DPT\TESTBENCH\test_adversarial_cas.py::test_cas_truncation_detected_by_hash_toolbelt PASSED [  2%]
CATALYTIC-DPT\TESTBENCH\test_adversarial_cas.py::test_cas_partial_write_never_treated_as_present PASSED [  3%]
CATALYTIC-DPT\TESTBENCH\test_adversarial_ledger.py::test_ledger_rejects_malformed_json_line PASSED [  3%]
CATALYTIC-DPT\TESTBENCH\test_adversarial_ledger.py::test_ledger_rejects_truncated_last_line_mid_byte PASSED [  4%]
CATALYTIC-DPT\TESTBENCH\test_adversarial_paths.py::test_normalize_relpath_rejects_traversal_and_absolute PASSED [  4%]
CATALYTIC-DPT\TESTBENCH\test_adversarial_paths.py::test_normalize_relpath_normalizes_separators_and_dot PASSED [  4%]
CATALYTIC-DPT\TESTBENCH\test_adversarial_paths.py::test_merkle_rejects_non_normalized_paths PASSED [  5%]
CATALYTIC-DPT\TESTBENCH\test_adversarial_pipeline_resume.py::test_pipeline_fails_closed_on_partial_state_json PASSED [  5%]
CATALYTIC-DPT\TESTBENCH\test_adversarial_pipeline_resume.py::test_pipeline_fails_closed_on_inconsistent_completed_step_state PASSED [  6%]
CATALYTIC-DPT\TESTBENCH\test_adversarial_pipeline_resume.py::test_pipeline_resume_never_skips_a_missing_step_record PASSED [  6%]
CATALYTIC-DPT\TESTBENCH\test_adversarial_proof_tamper.py::test_proof_hash_tamper_fails_closed_deterministically PASSED [  7%]
CATALYTIC-DPT\TESTBENCH\test_adversarial_proof_tamper.py::test_output_hash_manifest_tamper_fails_closed PASSED [  7%]
CATALYTIC-DPT\TESTBENCH\test_adversarial_proof_tamper.py::test_domain_roots_tamper_rejected_by_cmp01_validator PASSED [  8%]
CATALYTIC-DPT\TESTBENCH\test_ags_phase6_adapter_contract.py::test_adapter_happy_path_deterministic PASSED [  8%]
CATALYTIC-DPT\TESTBENCH\test_ags_phase6_adapter_contract.py::test_adapter_reject_missing_command PASSED [  8%]
CATALYTIC-DPT\TESTBENCH\test_ags_phase6_adapter_contract.py::test_adapter_reject_hidden_side_effects PASSED [  9%]
CATALYTIC-DPT\TESTBENCH\test_ags_phase6_adapter_contract.py::test_adapter_reject_unbounded_deref_caps PASSED [  9%]
CATALYTIC-DPT\TESTBENCH\test_ags_phase6_adapter_contract.py::test_adapter_reject_non_normalized_paths PASSED [ 10%]
CATALYTIC-DPT\TESTBENCH\test_ags_phase6_adapter_contract.py::test_adapter_reject_nondeterministic_flag_strict PASSED [ 10%]
CATALYTIC-DPT\TESTBENCH\test_ags_phase6_bridge.py::test_ags_route_deterministic_bytes PASSED [ 11%]
CATALYTIC-DPT\TESTBENCH\test_ags_phase6_bridge.py::test_ags_run_calls_verify_ok FAILED [ 11%]
CATALYTIC-DPT\TESTBENCH\test_ags_phase6_bridge.py::test_ags_run_fails_closed_on_tamper FAILED [ 12%]
CATALYTIC-DPT\TESTBENCH\test_ags_phase6_bridge.py::test_pipeline_run_creates_state_when_missing PASSED [ 12%]
CATALYTIC-DPT\TESTBENCH\test_ags_phase6_capability_pins.py::test_capability_pinned_routes_and_verifies FAILED [ 12%]
CATALYTIC-DPT\TESTBENCH\test_ags_phase6_capability_pins.py::test_known_but_unpinned_rejects_at_route PASSED [ 13%]
CATALYTIC-DPT\TESTBENCH\test_ags_phase6_capability_pins.py::test_verify_rejects_unpinned_even_if_pipeline_artifact_exists FAILED [ 13%]
CATALYTIC-DPT\TESTBENCH\test_ags_phase6_capability_registry.py::test_capability_registry_happy_unknown_and_tamper FAILED [ 14%]
CATALYTIC-DPT\TESTBENCH\test_ags_phase6_capability_revokes.py::test_revoked_capability_rejects_at_route PASSED [ 14%]
CATALYTIC-DPT\TESTBENCH\test_ags_phase6_capability_revokes.py::test_verify_rejects_revoked_capability PASSED [ 15%]
CATALYTIC-DPT\TESTBENCH\test_ags_phase6_capability_revokes.py::test_verify_passes_when_not_revoked PASSED [ 15%]
CATALYTIC-DPT\TESTBENCH\test_ags_phase6_capability_revokes.py::test_historical_pipeline_verifies_after_revocation PASSED [ 16%]
CATALYTIC-DPT\TESTBENCH\test_ags_phase6_capability_versioning_semantics.py::test_capability_versioning_in_place_upgrade_rejected PASSED [ 16%]
CATALYTIC-DPT\TESTBENCH\test_ags_phase6_mcp_adapter_e2e.py::test_happy_echo PASSED [ 16%]
CATALYTIC-DPT\TESTBENCH\test_ags_phase6_mcp_adapter_e2e.py::test_fail_stderr PASSED [ 17%]
CATALYTIC-DPT\TESTBENCH\test_ags_phase6_mcp_adapter_e2e.py::test_fail_timeout PASSED [ 17%]
CATALYTIC-DPT\TESTBENCH\test_ags_phase6_mcp_adapter_e2e.py::test_fail_bloat PASSED [ 18%]
CATALYTIC-DPT\TESTBENCH\test_ags_phase6_mcp_adapter_e2e.py::test_fail_malformed_output PASSED [ 18%]
CATALYTIC-DPT\TESTBENCH\test_ags_phase6_mcp_adapter_e2e.py::test_fail_crash PASSED [ 19%]
CATALYTIC-DPT\TESTBENCH\test_ags_phase6_registry_immutability.py::test_registry_duplicate_capability_hash_rejects PASSED [ 19%]
CATALYTIC-DPT\TESTBENCH\test_ags_phase6_registry_immutability.py::test_registry_noncanonical_json_rejects PASSED [ 20%]
CATALYTIC-DPT\TESTBENCH\test_ags_phase6_registry_immutability.py::test_registry_tamper_detected_fail_closed PASSED [ 20%]
CATALYTIC-DPT\TESTBENCH\test_ags_phase6_router_slot.py::test_ags_plan_router_happy_path FAILED [ 20%]
CATALYTIC-DPT\TESTBENCH\test_ags_phase6_router_slot.py::test_ags_plan_fails_on_stderr PASSED [ 21%]
CATALYTIC-DPT\TESTBENCH\test_ags_phase6_router_slot.py::test_ags_plan_caps_bytes PASSED [ 21%]
CATALYTIC-DPT\TESTBENCH\test_ags_phase6_router_slot.py::test_ags_route_rejects_invalid_plan_schema PASSED [ 22%]
CATALYTIC-DPT\TESTBENCH\test_ags_phase6_router_slot.py::test_ags_plan_jobspec_validation PASSED [ 22%]
CATALYTIC-DPT\TESTBENCH\test_ags_phase6_router_slot.py::test_ags_route_rejects_missing_step_command PASSED [ 23%]
CATALYTIC-DPT\TESTBENCH\test_ags_phase8_model_binding.py::test_ags_plan_emits_router_receipts PASSED [ 23%]
CATALYTIC-DPT\TESTBENCH\test_ags_phase8_model_binding.py::test_ags_plan_over_output_fails_closed PASSED [ 24%]
CATALYTIC-DPT\TESTBENCH\test_canonical_artifacts.py::test_canonical_artifact_set_required PASSED [ 24%]
CATALYTIC-DPT\TESTBENCH\test_canonical_artifacts.py::test_status_state_machine PASSED [ 24%]
CATALYTIC-DPT\TESTBENCH\test_canonical_artifacts.py::test_proof_written_last PASSED [ 25%]
CATALYTIC-DPT\TESTBENCH\test_cas_store.py::test_put_bytes_same_bytes_same_hash PASSED [ 25%]
CATALYTIC-DPT\TESTBENCH\test_cas_store.py::test_put_bytes_idempotent_does_not_change_bytes PASSED [ 26%]
CATALYTIC-DPT\TESTBENCH\test_cas_store.py::test_put_stream_matches_put_bytes PASSED [ 26%]
CATALYTIC-DPT\TESTBENCH\test_cas_store.py::test_large_stream_roundtrip PASSED [ 27%]
CATALYTIC-DPT\TESTBENCH\test_cas_store.py::test_deterministic_object_path_across_instances PASSED [ 27%]
CATALYTIC-DPT\TESTBENCH\test_cas_store.py::test_reject_invalid_hash_and_missing_hash PASSED [ 28%]
CATALYTIC-DPT\TESTBENCH\test_cas_store.py::test_normalize_relpath_accepts_and_normalizes PASSED [ 28%]
CATALYTIC-DPT\TESTBENCH\test_cas_store.py::test_normalize_relpath_rejects_absolute_and_traversal PASSED [ 28%]
CATALYTIC-DPT\TESTBENCH\test_demo_memoization_hash_reuse.py::test_phase2_demo_artifacts_are_falsifiable PASSED [ 29%]
CATALYTIC-DPT\TESTBENCH\test_deref_logging.py::test_deref_logging_creates_ledger_entry PASSED [ 29%]
CATALYTIC-DPT\TESTBENCH\test_deref_logging.py::test_deref_logging_records_exact_bounds PASSED [ 30%]
CATALYTIC-DPT\TESTBENCH\test_deref_logging.py::test_deref_logging_determinism PASSED [ 30%]
CATALYTIC-DPT\TESTBENCH\test_deref_logging.py::test_deref_logging_no_run_context_skips_logging PASSED [ 31%]
CATALYTIC-DPT\TESTBENCH\test_deref_logging.py::test_deref_logging_all_commands PASSED [ 31%]
CATALYTIC-DPT\TESTBENCH\test_deref_logging.py::test_deref_logging_schema_conformance PASSED [ 32%]
CATALYTIC-DPT\TESTBENCH\test_governance_coverage.py::test_roadmap_deliverables_exist PASSED [ 32%]
CATALYTIC-DPT\TESTBENCH\test_governance_coverage.py::test_canon_mentions_key_concepts PASSED [ 32%]
CATALYTIC-DPT\TESTBENCH\test_governance_coverage.py::test_router_receipt_artifacts_in_schema PASSED [ 33%]
CATALYTIC-DPT\TESTBENCH\test_governance_coverage.py::test_policy_snapshot_logic_exists PASSED [ 33%]
CATALYTIC-DPT\TESTBENCH\test_governance_coverage.py::test_swarm_schema_validity PASSED [ 34%]
CATALYTIC-DPT\TESTBENCH\test_hash_toolbelt.py::test_read_enforces_max_bytes PASSED [ 34%]
CATALYTIC-DPT\TESTBENCH\test_hash_toolbelt.py::test_read_range_and_clamp PASSED [ 35%]
CATALYTIC-DPT\TESTBENCH\test_hash_toolbelt.py::test_grep_bounds PASSED   [ 35%]
CATALYTIC-DPT\TESTBENCH\test_hash_toolbelt.py::test_describe_deterministic_and_bounded PASSED [ 36%]
CATALYTIC-DPT\TESTBENCH\test_hash_toolbelt.py::test_ast_outline_and_truncation PASSED [ 36%]
CATALYTIC-DPT\TESTBENCH\test_hash_toolbelt.py::test_ast_unsupported_binary PASSED [ 36%]
CATALYTIC-DPT\TESTBENCH\test_hash_toolbelt.py::test_invalid_hash_rejects PASSED [ 37%]
CATALYTIC-DPT\TESTBENCH\test_ledger.py::test_append_single_record_one_line PASSED [ 37%]
CATALYTIC-DPT\TESTBENCH\test_ledger.py::test_append_multiple_records_order_preserved PASSED [ 38%]
CATALYTIC-DPT\TESTBENCH\test_ledger.py::test_deterministic_serialization_same_bytes PASSED [ 38%]
CATALYTIC-DPT\TESTBENCH\test_ledger.py::test_schema_rejection_missing_required_fields PASSED [ 39%]
CATALYTIC-DPT\TESTBENCH\test_ledger.py::test_append_only_enforcement_detects_truncation PASSED [ 39%]
CATALYTIC-DPT\TESTBENCH\test_ledger.py::test_corrupt_line_detection PASSED [ 40%]
CATALYTIC-DPT\TESTBENCH\test_ledger.py::test_partial_line_detection PASSED [ 40%]
CATALYTIC-DPT\TESTBENCH\test_memoization.py::test_memoization_miss_then_hit_then_invalidate PASSED [ 40%]
CATALYTIC-DPT\TESTBENCH\test_merkle.py::test_deterministic_root_across_runs PASSED [ 41%]
CATALYTIC-DPT\TESTBENCH\test_merkle.py::test_path_ordering_independent_of_input_order PASSED [ 41%]
CATALYTIC-DPT\TESTBENCH\test_merkle.py::test_duplicate_path_rejection_via_non_normalized_collision PASSED [ 42%]
CATALYTIC-DPT\TESTBENCH\test_merkle.py::test_duplicate_hash_under_different_paths_rejected PASSED [ 42%]
CATALYTIC-DPT\TESTBENCH\test_merkle.py::test_odd_leaf_padding_correctness PASSED [ 43%]
CATALYTIC-DPT\TESTBENCH\test_merkle.py::test_empty_manifest_rejected PASSED [ 43%]
CATALYTIC-DPT\TESTBENCH\test_merkle.py::test_verify_manifest_root_true_false PASSED [ 44%]
CATALYTIC-DPT\TESTBENCH\test_merkle.py::test_reject_non_normalized_paths PASSED [ 44%]
CATALYTIC-DPT\TESTBENCH\test_merkle.py::test_reject_invalid_hashes_and_expected_root_format PASSED [ 44%]
CATALYTIC-DPT\TESTBENCH\test_packing_hygiene.py::test_packer_determinism_catalytic_dpt FAILED [ 45%]
CATALYTIC-DPT\TESTBENCH\test_packing_hygiene.py::test_packer_limits_fail_closed[limits0-PACK_LIMIT_EXCEEDED:max_total_bytes] PASSED [ 45%]
CATALYTIC-DPT\TESTBENCH\test_packing_hygiene.py::test_packer_limits_fail_closed[limits1-PACK_LIMIT_EXCEEDED:max_entry_bytes] PASSED [ 46%]
CATALYTIC-DPT\TESTBENCH\test_packing_hygiene.py::test_packer_limits_fail_closed[limits2-PACK_LIMIT_EXCEEDED:max_entries] PASSED [ 46%]
CATALYTIC-DPT\TESTBENCH\test_packing_hygiene.py::test_repo_state_manifest_validation_and_dedup PASSED [ 47%]
CATALYTIC-DPT\TESTBENCH\test_packing_hygiene.py::test_verify_manifest_detects_tamper PASSED [ 47%]
CATALYTIC-DPT\TESTBENCH\test_phase7_acceptance.py::test_swarm_chain_binds_pipeline_proofs PASSED [ 48%]
CATALYTIC-DPT\TESTBENCH\test_phase7_acceptance.py::test_tampered_pipeline_proof_fails_verification PASSED [ 48%]
CATALYTIC-DPT\TESTBENCH\test_phase8_router_receipts.py::test_router_receipts_created PASSED [ 48%]
CATALYTIC-DPT\TESTBENCH\test_phase8_router_receipts.py::test_router_over_output_fails_closed PASSED [ 49%]
CATALYTIC-DPT\TESTBENCH\test_phase8_router_receipts.py::test_router_stderr_fails_closed PASSED [ 49%]
CATALYTIC-DPT\TESTBENCH\test_phase8_router_receipts.py::test_malformed_plan_fails_schema_validation PASSED [ 50%]
CATALYTIC-DPT\TESTBENCH\test_phase8_router_receipts.py::test_capability_escalation_fails_closed PASSED [ 50%]
CATALYTIC-DPT\TESTBENCH\test_pipeline_chain.py::test_pipeline_chain_valid PASSED [ 51%]
CATALYTIC-DPT\TESTBENCH\test_pipeline_chain.py::test_pipeline_chain_tamper PASSED [ 51%]
CATALYTIC-DPT\TESTBENCH\test_pipeline_chain.py::test_pipeline_chain_reorder PASSED [ 52%]
CATALYTIC-DPT\TESTBENCH\test_pipeline_chain.py::test_pipeline_chain_determinism PASSED [ 52%]
CATALYTIC-DPT\TESTBENCH\test_pipeline_dag.py::test_receipt_includes_policy_proof PASSED [ 52%]
CATALYTIC-DPT\TESTBENCH\test_pipeline_dag.py::test_pipeline_dag_happy_path_and_verify PASSED [ 53%]
CATALYTIC-DPT\TESTBENCH\test_pipeline_dag.py::test_pipeline_dag_resume_does_not_rerun_completed PASSED [ 53%]
CATALYTIC-DPT\TESTBENCH\test_pipeline_dag.py::test_pipeline_dag_cycle_detected PASSED [ 54%]
CATALYTIC-DPT\TESTBENCH\test_pipeline_dag.py::test_pipeline_dag_tamper_rejected PASSED [ 54%]
CATALYTIC-DPT\TESTBENCH\test_pipeline_dag.py::test_pipeline_dag_receipt_chain_mismatch PASSED [ 55%]
CATALYTIC-DPT\TESTBENCH\test_pipeline_dag.py::test_pipeline_dag_receipts_portable PASSED [ 55%]
CATALYTIC-DPT\TESTBENCH\test_pipeline_dag.py::test_pipeline_dag_restore_noop PASSED [ 56%]
CATALYTIC-DPT\TESTBENCH\test_pipeline_dag.py::test_pipeline_dag_restore_missing_artifact PASSED [ 56%]
CATALYTIC-DPT\TESTBENCH\test_pipeline_dag.py::test_pipeline_dag_restore_tampered_receipt PASSED [ 56%]
CATALYTIC-DPT\TESTBENCH\test_pipeline_dag.py::test_pipeline_dag_restore_portable PASSED [ 57%]
CATALYTIC-DPT\TESTBENCH\test_pipeline_verify_cli.py::test_pipeline_verify_ok PASSED [ 57%]
CATALYTIC-DPT\TESTBENCH\test_pipeline_verify_cli.py::test_pipeline_verify_missing_artifact PASSED [ 58%]
CATALYTIC-DPT\TESTBENCH\test_pipeline_verify_cli.py::test_pipeline_verify_chain_tamper PASSED [ 58%]
CATALYTIC-DPT\TESTBENCH\test_pipeline_verify_cli.py::test_pipeline_verify_ledger_corrupt PASSED [ 59%]
CATALYTIC-DPT\TESTBENCH\test_pipelines.py::test_pipeline_init_is_deterministic_and_resume_safe PASSED [ 59%]
CATALYTIC-DPT\TESTBENCH\test_preflight.py::test_valid_jobspec_passes PASSED [ 60%]
CATALYTIC-DPT\TESTBENCH\test_preflight.py::test_invalid_jobspec_schema_fails PASSED [ 60%]
CATALYTIC-DPT\TESTBENCH\test_preflight.py::test_path_traversal_fails PASSED [ 60%]
CATALYTIC-DPT\TESTBENCH\test_preflight.py::test_absolute_path_fails PASSED [ 61%]
CATALYTIC-DPT\TESTBENCH\test_preflight.py::test_path_not_under_allowed_root_fails PASSED [ 61%]
CATALYTIC-DPT\TESTBENCH\test_preflight.py::test_forbidden_path_fails PASSED [ 62%]
CATALYTIC-DPT\TESTBENCH\test_preflight.py::test_input_output_overlap_fails PASSED [ 62%]
CATALYTIC-DPT\TESTBENCH\test_preflight.py::test_multiple_errors_reported PASSED [ 63%]
CATALYTIC-DPT\TESTBENCH\test_preflight.py::test_empty_catalytic_domains_valid PASSED [ 63%]
CATALYTIC-DPT\TESTBENCH\test_preflight.py::test_empty_outputs_valid PASSED [ 64%]
CATALYTIC-DPT\TESTBENCH\test_proof_gating.py::test_valid_proof_accepted PASSED [ 64%]
CATALYTIC-DPT\TESTBENCH\test_proof_gating.py::test_invalid_proof_rejected PASSED [ 64%]
CATALYTIC-DPT\TESTBENCH\test_proof_gating.py::test_missing_proof_rejected PASSED [ 65%]
CATALYTIC-DPT\TESTBENCH\test_proof_gating.py::test_proof_is_single_source_of_truth PASSED [ 65%]
CATALYTIC-DPT\TESTBENCH\test_proof_wiring.py::test_rerun_determinism_proof_and_domain_roots_bytes_identical PASSED [ 66%]
CATALYTIC-DPT\TESTBENCH\test_proof_wiring.py::test_tamper_detection_hash_mismatch PASSED [ 66%]
CATALYTIC-DPT\TESTBENCH\test_proof_wiring.py::test_path_normalization_rejects_traversal PASSED [ 67%]
CATALYTIC-DPT\TESTBENCH\test_restore_proof.py::test_identical_artifacts_verified_true PASSED [ 67%]
CATALYTIC-DPT\TESTBENCH\test_restore_proof.py::test_hash_mismatch_verified_false PASSED [ 68%]
CATALYTIC-DPT\TESTBENCH\test_restore_proof.py::test_missing_files_verified_false PASSED [ 68%]
CATALYTIC-DPT\TESTBENCH\test_restore_proof.py::test_extra_files_verified_false PASSED [ 68%]
CATALYTIC-DPT\TESTBENCH\test_restore_proof.py::test_deterministic_output PASSED [ 69%]
CATALYTIC-DPT\TESTBENCH\test_restore_proof.py::test_proof_validates_against_schema PASSED [ 69%]
CATALYTIC-DPT\TESTBENCH\test_restore_proof.py::test_empty_domains_verified_true PASSED [ 70%]
CATALYTIC-DPT\TESTBENCH\test_restore_runner.py::test_restore_rejects_when_verifier_strict_fails PASSED [ 70%]
CATALYTIC-DPT\TESTBENCH\test_restore_runner.py::test_restore_rejects_when_proof_missing PASSED [ 71%]
CATALYTIC-DPT\TESTBENCH\test_restore_runner.py::test_restore_reject_if_target_exists PASSED [ 71%]
CATALYTIC-DPT\TESTBENCH\test_restore_runner.py::test_restore_rejects_traversal_path PASSED [ 72%]
CATALYTIC-DPT\TESTBENCH\test_restore_runner.py::test_restore_rejects_symlink_escape PASSED [ 72%]
CATALYTIC-DPT\TESTBENCH\test_restore_runner.py::test_restore_staging_hash_mismatch_rolls_back PASSED [ 72%]
CATALYTIC-DPT\TESTBENCH\test_restore_runner.py::test_restore_success_emits_artifacts_and_matches_hashes PASSED [ 73%]
CATALYTIC-DPT\TESTBENCH\test_restore_runner.py::test_chain_restore_all_or_nothing PASSED [ 73%]
CATALYTIC-DPT\TESTBENCH\test_restore_runner.py::test_restore_rollback_failure_returns_restore_rollback_failed PASSED [ 74%]
CATALYTIC-DPT\TESTBENCH\test_runtime_guard.py::test_allowed_write_succeeds PASSED [ 74%]
CATALYTIC-DPT\TESTBENCH\test_runtime_guard.py::test_guarded_write_text_succeeds PASSED [ 75%]
CATALYTIC-DPT\TESTBENCH\test_runtime_guard.py::test_forbidden_path_fails PASSED [ 75%]
CATALYTIC-DPT\TESTBENCH\test_runtime_guard.py::test_forbidden_path_guarded_write_fails PASSED [ 76%]
CATALYTIC-DPT\TESTBENCH\test_runtime_guard.py::test_write_outside_allowed_roots_fails PASSED [ 76%]
CATALYTIC-DPT\TESTBENCH\test_runtime_guard.py::test_path_traversal_fails PASSED [ 76%]
CATALYTIC-DPT\TESTBENCH\test_runtime_guard.py::test_absolute_path_outside_project_fails PASSED [ 77%]
CATALYTIC-DPT\TESTBENCH\test_runtime_guard.py::test_multiple_allowed_roots_work PASSED [ 77%]
CATALYTIC-DPT\TESTBENCH\test_runtime_guard.py::test_all_forbidden_paths_rejected PASSED [ 78%]
CATALYTIC-DPT\TESTBENCH\test_runtime_guard.py::test_guarded_mkdir_succeeds PASSED [ 78%]
CATALYTIC-DPT\TESTBENCH\test_runtime_guard.py::test_guarded_mkdir_forbidden_fails PASSED [ 79%]
CATALYTIC-DPT\TESTBENCH\test_runtime_guard.py::test_guarded_write_bytes_succeeds PASSED [ 79%]
CATALYTIC-DPT\TESTBENCH\test_runtime_guard.py::test_path_normalization PASSED [ 80%]
CATALYTIC-DPT\TESTBENCH\test_schemas.py::test_all_schemas PASSED         [ 80%]
CATALYTIC-DPT\TESTBENCH\test_skills_registry.py::test_canonical_json PASSED [ 80%]
CATALYTIC-DPT\TESTBENCH\test_skills_registry.py::test_load_valid_registry PASSED [ 81%]
CATALYTIC-DPT\TESTBENCH\test_skills_registry.py::test_load_missing_registry PASSED [ 81%]
CATALYTIC-DPT\TESTBENCH\test_skills_registry.py::test_load_malformed_registry PASSED [ 82%]
CATALYTIC-DPT\TESTBENCH\test_skills_registry.py::test_resolve_missing_skill PASSED [ 82%]
CATALYTIC-DPT\TESTBENCH\test_skills_registry.py::test_e2e_resolution PASSED [ 83%]
CATALYTIC-DPT\TESTBENCH\test_skills_registry.py::test_e2e_integrity_fail PASSED [ 83%]
CATALYTIC-DPT\TESTBENCH\test_spectrum_04_05_enforcement.py::test_canonicalize_json PASSED [ 84%]
CATALYTIC-DPT\TESTBENCH\test_spectrum_04_05_enforcement.py::test_bundle_root_computation PASSED [ 84%]
CATALYTIC-DPT\TESTBENCH\test_spectrum_04_05_enforcement.py::test_chain_root_computation PASSED [ 84%]
CATALYTIC-DPT\TESTBENCH\test_spectrum_04_05_enforcement.py::test_ed25519_signature_verification PASSED [ 85%]
CATALYTIC-DPT\TESTBENCH\test_spectrum_04_05_enforcement.py::test_validator_id_derivation PASSED [ 85%]
CATALYTIC-DPT\TESTBENCH\test_spectrum_04_05_enforcement.py::test_spectrum05_missing_artifact PASSED [ 86%]
CATALYTIC-DPT\TESTBENCH\test_spectrum_04_05_enforcement.py::test_spectrum05_identity_invalid PASSED [ 86%]
CATALYTIC-DPT\TESTBENCH\test_spectrum_04_05_enforcement.py::test_spectrum05_chain_empty PASSED [ 87%]
CATALYTIC-DPT\TESTBENCH\test_spectrum_04_05_enforcement.py::test_spectrum05_chain_duplicate_run PASSED [ 87%]
CATALYTIC-DPT\TESTBENCH\test_swarm_reuse.py::test_swarm_execution_elision FAILED [ 88%]
CATALYTIC-DPT\TESTBENCH\test_swarm_runtime.py::test_swarm_runtime_happy_path PASSED [ 88%]
CATALYTIC-DPT\TESTBENCH\test_verifier_freeze.py::test_api_return_shape_bundle PASSED [ 88%]
CATALYTIC-DPT\TESTBENCH\test_verifier_freeze.py::test_api_return_shape_chain PASSED [ 89%]
CATALYTIC-DPT\TESTBENCH\test_verifier_freeze.py::test_frozen_error_codes_exist PASSED [ 89%]
CATALYTIC-DPT\TESTBENCH\test_verifier_freeze.py::test_crypto_dep_missing_fail_closed PASSED [ 90%]
CATALYTIC-DPT\TESTBENCH\test_verifier_freeze.py::test_chain_dir_ordering_deterministic PASSED [ 90%]
CATALYTIC-DPT\TESTBENCH\test_verifier_interop.py::test_interop_valid_bundle_byte_identical PASSED [ 91%]
CATALYTIC-DPT\TESTBENCH\test_verifier_interop.py::test_interop_tampered_bundle_reject_same_code_and_bytes PASSED [ 91%]
CATALYTIC-DPT\TESTBENCH\test_verifier_interop.py::test_interop_chain_verification_byte_identical PASSED [ 92%]
CATALYTIC-DPT\TESTBENCH\test_verifier_interop.py::test_interop_determinism_rerun_same_inputs_same_bytes PASSED [ 92%]
CATALYTIC-DPT\TESTBENCH\test_verify_bundle.py::test_valid_bundle PASSED  [ 92%]
CATALYTIC-DPT\TESTBENCH\test_verify_bundle.py::test_missing_task_spec PASSED [ 93%]
CATALYTIC-DPT\TESTBENCH\test_verify_bundle.py::test_missing_status PASSED [ 93%]
CATALYTIC-DPT\TESTBENCH\test_verify_bundle.py::test_missing_output_hashes PASSED [ 94%]
CATALYTIC-DPT\TESTBENCH\test_verify_bundle.py::test_status_not_success PASSED [ 94%]
CATALYTIC-DPT\TESTBENCH\test_verify_bundle.py::test_cmp01_not_pass PASSED [ 95%]
CATALYTIC-DPT\TESTBENCH\test_verify_bundle.py::test_output_missing PASSED [ 95%]
CATALYTIC-DPT\TESTBENCH\test_verify_bundle.py::test_hash_mismatch PASSED [ 96%]
CATALYTIC-DPT\TESTBENCH\test_verify_bundle.py::test_proof_required PASSED [ 96%]
CATALYTIC-DPT\TESTBENCH\test_verify_bundle.py::test_proof_not_verified PASSED [ 96%]
CATALYTIC-DPT\TESTBENCH\test_verify_bundle.py::test_forbidden_artifact_logs PASSED [ 97%]
CATALYTIC-DPT\TESTBENCH\test_verify_bundle.py::test_forbidden_artifact_tmp PASSED [ 97%]
CATALYTIC-DPT\TESTBENCH\test_verify_bundle.py::test_forbidden_artifact_transcript PASSED [ 98%]
CATALYTIC-DPT\TESTBENCH\test_verify_bundle.py::test_no_proof_check_skips_proof PASSED [ 98%]
CATALYTIC-DPT\TESTBENCH\test_verify_bundle.py::test_chain_valid PASSED   [ 99%]
CATALYTIC-DPT\TESTBENCH\test_verify_bundle.py::test_chain_rejects_middle_tamper PASSED [ 99%]
CATALYTIC-DPT\TESTBENCH\test_verify_bundle.py::test_chain_rejects_missing_artifact PASSED [100%]

============================== warnings summary ===============================
CATALYTIC-DPT\PRIMITIVES\ledger.py:9
CATALYTIC-DPT\PRIMITIVES\ledger.py:9
  D:\CCC 2.0\AI\agent-governance-system\CATALYTIC-DPT\PRIMITIVES\ledger.py:9: DeprecationWarning: jsonschema.RefResolver is deprecated as of v4.18.0, in favor of the https://github.com/python-jsonschema/referencing library, which provides more compliant referencing behavior as well as more flexible APIs for customization. A future release will remove RefResolver. Please file a feature request (on referencing) if you are missing an API for the kind of customization you need.
    from jsonschema import Draft7Validator, RefResolver

CATALYTIC-DPT\TESTBENCH\test_schemas.py:22
CATALYTIC-DPT\TESTBENCH\test_schemas.py:22
  D:\CCC 2.0\AI\agent-governance-system\CATALYTIC-DPT\TESTBENCH\test_schemas.py:22: DeprecationWarning: jsonschema.RefResolver is deprecated as of v4.18.0, in favor of the https://github.com/python-jsonschema/referencing library, which provides more compliant referencing behavior as well as more flexible APIs for customization. A future release will remove RefResolver. Please file a feature request (on referencing) if you are missing an API for the kind of customization you need.
    from jsonschema import Draft7Validator, RefResolver

-- Docs: https://docs.pytest.org/en/stable/how-to/capture-warnings.html
=========================== short test summary info ===========================
FAILED CATALYTIC-DPT\TESTBENCH\test_ags_phase6_bridge.py::test_ags_run_calls_verify_ok
FAILED CATALYTIC-DPT\TESTBENCH\test_ags_phase6_bridge.py::test_ags_run_fails_closed_on_tamper
FAILED CATALYTIC-DPT\TESTBENCH\test_ags_phase6_capability_pins.py::test_capability_pinned_routes_and_verifies
FAILED CATALYTIC-DPT\TESTBENCH\test_ags_phase6_capability_pins.py::test_verify_rejects_unpinned_even_if_pipeline_artifact_exists
FAILED CATALYTIC-DPT\TESTBENCH\test_ags_phase6_capability_registry.py::test_capability_registry_happy_unknown_and_tamper
FAILED CATALYTIC-DPT\TESTBENCH\test_ags_phase6_router_slot.py::test_ags_plan_router_happy_path
FAILED CATALYTIC-DPT\TESTBENCH\test_packing_hygiene.py::test_packer_determinism_catalytic_dpt
FAILED CATALYTIC-DPT\TESTBENCH\test_swarm_reuse.py::test_swarm_execution_elision
================= 8 failed, 217 passed, 4 warnings in 58.18s ==================
