`trust_remote_code` is not supported anymore.
Please check that the Hugging Face dataset 'scifact' isn't based on a loading script and remove `trust_remote_code`.
If the dataset is based on a loading script, please ask the dataset author to remove it and convert it to a standard format like Parquet.
Using the latest cached version of the dataset since scifact couldn't be found on the Hugging Face Hub
Found the latest cached dataset configuration 'claims' at D:\CCC 2.0\AI\wt-q32-next\THOUGHT\LAW\CONTRACTS\_runs\q32_public\hf_cache\datasets\scifact\claims\1.0.0\15660e43ecfb3f7420850027005a63611abb2d401e9746b4059c1260745d9831 (last modified on Thu Jan  8 23:36:18 2026).
`trust_remote_code` is not supported anymore.
Please check that the Hugging Face dataset 'scifact' isn't based on a loading script and remove `trust_remote_code`.
If the dataset is based on a loading script, please ask the dataset author to remove it and convert it to a standard format like Parquet.
Using the latest cached version of the dataset since scifact couldn't be found on the Hugging Face Hub
Found the latest cached dataset configuration 'corpus' at D:\CCC 2.0\AI\wt-q32-next\THOUGHT\LAW\CONTRACTS\_runs\q32_public\hf_cache\datasets\scifact\corpus\1.0.0\15660e43ecfb3f7420850027005a63611abb2d401e9746b4059c1260745d9831 (last modified on Thu Jan  8 23:36:21 2026).
C:\Users\rene_\AppData\Local\Programs\Python\Python311\Lib\site-packages\transformers\utils\hub.py:110: FutureWarning: Using `TRANSFORMERS_CACHE` is deprecated and will be removed in v5 of Transformers. Use `HF_HOME` instead.
  warnings.warn(
2026-01-09 23:20:42.292481: I tensorflow/core/util/port.cc:153] oneDNN custom operations are on. You may see slightly different numerical results due to floating-point round-off errors from different computation orders. To turn them off, set the environment variable `TF_ENABLE_ONEDNN_OPTS=0`.
2026-01-09 23:20:43.348659: I tensorflow/core/util/port.cc:153] oneDNN custom operations are on. You may see slightly different numerical results due to floating-point round-off errors from different computation orders. To turn them off, set the environment variable `TF_ENABLE_ONEDNN_OPTS=0`.
WARNING:tensorflow:From C:\Users\rene_\AppData\Local\Programs\Python\Python311\Lib\site-packages\tf_keras\src\losses.py:2976: The name tf.losses.sparse_softmax_cross_entropy is deprecated. Please use tf.compat.v1.losses.sparse_softmax_cross_entropy instead.

`trust_remote_code` is not supported anymore.
Please check that the Hugging Face dataset 'scifact' isn't based on a loading script and remove `trust_remote_code`.
If the dataset is based on a loading script, please ask the dataset author to remove it and convert it to a standard format like Parquet.
Using the latest cached version of the dataset since scifact couldn't be found on the Hugging Face Hub
Found the latest cached dataset configuration 'claims' at D:\CCC 2.0\AI\wt-q32-next\THOUGHT\LAW\CONTRACTS\_runs\q32_public\hf_cache\datasets\scifact\claims\1.0.0\15660e43ecfb3f7420850027005a63611abb2d401e9746b4059c1260745d9831 (last modified on Thu Jan  8 23:36:18 2026).
`trust_remote_code` is not supported anymore.
Please check that the Hugging Face dataset 'scifact' isn't based on a loading script and remove `trust_remote_code`.
If the dataset is based on a loading script, please ask the dataset author to remove it and convert it to a standard format like Parquet.
Using the latest cached version of the dataset since scifact couldn't be found on the Hugging Face Hub
Found the latest cached dataset configuration 'corpus' at D:\CCC 2.0\AI\wt-q32-next\THOUGHT\LAW\CONTRACTS\_runs\q32_public\hf_cache\datasets\scifact\corpus\1.0.0\15660e43ecfb3f7420850027005a63611abb2d401e9746b4059c1260745d9831 (last modified on Thu Jan  8 23:36:21 2026).
`trust_remote_code` is not supported anymore.
Please check that the Hugging Face dataset 'scifact' isn't based on a loading script and remove `trust_remote_code`.
If the dataset is based on a loading script, please ask the dataset author to remove it and convert it to a standard format like Parquet.
Using the latest cached version of the dataset since scifact couldn't be found on the Hugging Face Hub
Found the latest cached dataset configuration 'claims' at D:\CCC 2.0\AI\wt-q32-next\THOUGHT\LAW\CONTRACTS\_runs\q32_public\hf_cache\datasets\scifact\claims\1.0.0\15660e43ecfb3f7420850027005a63611abb2d401e9746b4059c1260745d9831 (last modified on Thu Jan  8 23:36:18 2026).
`trust_remote_code` is not supported anymore.
Please check that the Hugging Face dataset 'scifact' isn't based on a loading script and remove `trust_remote_code`.
If the dataset is based on a loading script, please ask the dataset author to remove it and convert it to a standard format like Parquet.
Using the latest cached version of the dataset since scifact couldn't be found on the Hugging Face Hub
Found the latest cached dataset configuration 'corpus' at D:\CCC 2.0\AI\wt-q32-next\THOUGHT\LAW\CONTRACTS\_runs\q32_public\hf_cache\datasets\scifact\corpus\1.0.0\15660e43ecfb3f7420850027005a63611abb2d401e9746b4059c1260745d9831 (last modified on Thu Jan  8 23:36:21 2026).
`trust_remote_code` is not supported anymore.
Please check that the Hugging Face dataset 'scifact' isn't based on a loading script and remove `trust_remote_code`.
If the dataset is based on a loading script, please ask the dataset author to remove it and convert it to a standard format like Parquet.
Using the latest cached version of the dataset since scifact couldn't be found on the Hugging Face Hub
Found the latest cached dataset configuration 'claims' at D:\CCC 2.0\AI\wt-q32-next\THOUGHT\LAW\CONTRACTS\_runs\q32_public\hf_cache\datasets\scifact\claims\1.0.0\15660e43ecfb3f7420850027005a63611abb2d401e9746b4059c1260745d9831 (last modified on Thu Jan  8 23:36:18 2026).
`trust_remote_code` is not supported anymore.
Please check that the Hugging Face dataset 'scifact' isn't based on a loading script and remove `trust_remote_code`.
If the dataset is based on a loading script, please ask the dataset author to remove it and convert it to a standard format like Parquet.
Using the latest cached version of the dataset since scifact couldn't be found on the Hugging Face Hub
Found the latest cached dataset configuration 'corpus' at D:\CCC 2.0\AI\wt-q32-next\THOUGHT\LAW\CONTRACTS\_runs\q32_public\hf_cache\datasets\scifact\corpus\1.0.0\15660e43ecfb3f7420850027005a63611abb2d401e9746b4059c1260745d9831 (last modified on Thu Jan  8 23:36:21 2026).
`trust_remote_code` is not supported anymore.
Please check that the Hugging Face dataset 'scifact' isn't based on a loading script and remove `trust_remote_code`.
If the dataset is based on a loading script, please ask the dataset author to remove it and convert it to a standard format like Parquet.
Using the latest cached version of the dataset since scifact couldn't be found on the Hugging Face Hub
Found the latest cached dataset configuration 'claims' at D:\CCC 2.0\AI\wt-q32-next\THOUGHT\LAW\CONTRACTS\_runs\q32_public\hf_cache\datasets\scifact\claims\1.0.0\15660e43ecfb3f7420850027005a63611abb2d401e9746b4059c1260745d9831 (last modified on Thu Jan  8 23:36:18 2026).
`trust_remote_code` is not supported anymore.
Please check that the Hugging Face dataset 'scifact' isn't based on a loading script and remove `trust_remote_code`.
If the dataset is based on a loading script, please ask the dataset author to remove it and convert it to a standard format like Parquet.
Using the latest cached version of the dataset since scifact couldn't be found on the Hugging Face Hub
Found the latest cached dataset configuration 'corpus' at D:\CCC 2.0\AI\wt-q32-next\THOUGHT\LAW\CONTRACTS\_runs\q32_public\hf_cache\datasets\scifact\corpus\1.0.0\15660e43ecfb3f7420850027005a63611abb2d401e9746b4059c1260745d9831 (last modified on Thu Jan  8 23:36:21 2026).
`trust_remote_code` is not supported anymore.
Please check that the Hugging Face dataset 'scifact' isn't based on a loading script and remove `trust_remote_code`.
If the dataset is based on a loading script, please ask the dataset author to remove it and convert it to a standard format like Parquet.
Using the latest cached version of the dataset since scifact couldn't be found on the Hugging Face Hub
Found the latest cached dataset configuration 'claims' at D:\CCC 2.0\AI\wt-q32-next\THOUGHT\LAW\CONTRACTS\_runs\q32_public\hf_cache\datasets\scifact\claims\1.0.0\15660e43ecfb3f7420850027005a63611abb2d401e9746b4059c1260745d9831 (last modified on Thu Jan  8 23:36:18 2026).
`trust_remote_code` is not supported anymore.
Please check that the Hugging Face dataset 'scifact' isn't based on a loading script and remove `trust_remote_code`.
If the dataset is based on a loading script, please ask the dataset author to remove it and convert it to a standard format like Parquet.
Using the latest cached version of the dataset since scifact couldn't be found on the Hugging Face Hub
Found the latest cached dataset configuration 'corpus' at D:\CCC 2.0\AI\wt-q32-next\THOUGHT\LAW\CONTRACTS\_runs\q32_public\hf_cache\datasets\scifact\corpus\1.0.0\15660e43ecfb3f7420850027005a63611abb2d401e9746b4059c1260745d9831 (last modified on Thu Jan  8 23:36:21 2026).

[Q32:STRESS] SciFact streaming variability (trials=6)

[Q32:P4] SciFact streaming + intervention

[Q32:P4] Intervention: replace truth-consistent checks with wrong checks
  P(M_correct_end > M_wrong_end) = 0.675
  z(H0: p=0.5) = 3.834  (n=120)
  mean(M_correct_end) = -1.396
  mean(M_wrong_end)   = -2.524
  mean(M_correct - M_wrong) = 1.127
  [swap_correct] P(M_correct_end > M_swapped_correct_end) = 0.600
  [swap_correct] mean(M_correct_end - M_swapped_correct_end) = 3.707
  [swap_wrong] P(M_correct_end > M_swapped_wrong_end) = 0.650
  [swap_wrong] mean(M_correct_end - M_swapped_wrong_end) = 3.034
  [J] mean neighbor sim (k=10) = 0.345
  [Phi_proxy] mean I(mu_hat(t); mu_check(t)) = 1.587 bits

[Q32:P4] Streaming deltas
  mean dM_correct = -0.093
  mean dM_wrong   = -1.052

[Q32:P4] SciFact streaming + intervention

[Q32:P4] Intervention: replace truth-consistent checks with wrong checks
  P(M_correct_end > M_wrong_end) = 0.575
  z(H0: p=0.5) = 1.643  (n=120)
  mean(M_correct_end) = -2.426
  mean(M_wrong_end)   = -2.228
  mean(M_correct - M_wrong) = -0.198
  [swap_correct] P(M_correct_end > M_swapped_correct_end) = 0.550
  [swap_correct] mean(M_correct_end - M_swapped_correct_end) = 3.663
  [swap_wrong] P(M_correct_end > M_swapped_wrong_end) = 0.625
  [swap_wrong] mean(M_correct_end - M_swapped_wrong_end) = 2.591
  [J] mean neighbor sim (k=10) = 0.339
  [Phi_proxy] mean I(mu_hat(t); mu_check(t)) = 1.550 bits

[Q32:P4] Streaming deltas
  mean dM_correct = -0.883
  mean dM_wrong   = -0.583

[Q32:P4] SciFact streaming status: FAIL

[Q32:P4] SciFact streaming + intervention

[Q32:P4] Intervention: replace truth-consistent checks with wrong checks
  P(M_correct_end > M_wrong_end) = 0.633
  z(H0: p=0.5) = 2.921  (n=120)
  mean(M_correct_end) = -1.384
  mean(M_wrong_end)   = -2.071
  mean(M_correct - M_wrong) = 0.687
  [swap_correct] P(M_correct_end > M_swapped_correct_end) = 0.617
  [swap_correct] mean(M_correct_end - M_swapped_correct_end) = 4.499
  [swap_wrong] P(M_correct_end > M_swapped_wrong_end) = 0.683
  [swap_wrong] mean(M_correct_end - M_swapped_wrong_end) = 2.959
  [J] mean neighbor sim (k=10) = 0.340
  [Phi_proxy] mean I(mu_hat(t); mu_check(t)) = 1.601 bits

[Q32:P4] Streaming deltas
  mean dM_correct = -1.332
  mean dM_wrong   = -0.383

[Q32:P4] SciFact streaming status: FAIL

[Q32:P4] SciFact streaming + intervention

[Q32:P4] Intervention: replace truth-consistent checks with wrong checks
  P(M_correct_end > M_wrong_end) = 0.550
  z(H0: p=0.5) = 1.095  (n=120)
  mean(M_correct_end) = -5.024
  mean(M_wrong_end)   = -3.018
  mean(M_correct - M_wrong) = -2.006
  [swap_correct] P(M_correct_end > M_swapped_correct_end) = 0.525
  [swap_correct] mean(M_correct_end - M_swapped_correct_end) = 3.077
  [swap_wrong] P(M_correct_end > M_swapped_wrong_end) = 0.592
  [swap_wrong] mean(M_correct_end - M_swapped_wrong_end) = 0.381
  [J] mean neighbor sim (k=10) = 0.330
  [Phi_proxy] mean I(mu_hat(t); mu_check(t)) = 1.477 bits

[Q32:P4] Streaming deltas
  mean dM_correct = -3.376
  mean dM_wrong   = -1.259

[Q32:P4] SciFact streaming status: FAIL

[Q32:P4] SciFact streaming + intervention

[Q32:P4] Intervention: replace truth-consistent checks with wrong checks
  P(M_correct_end > M_wrong_end) = 0.658
  z(H0: p=0.5) = 3.469  (n=120)
  mean(M_correct_end) = -2.778
  mean(M_wrong_end)   = -2.494
  mean(M_correct - M_wrong) = -0.285
  [swap_correct] P(M_correct_end > M_swapped_correct_end) = 0.633
  [swap_correct] mean(M_correct_end - M_swapped_correct_end) = 4.818
  [swap_wrong] P(M_correct_end > M_swapped_wrong_end) = 0.600
  [swap_wrong] mean(M_correct_end - M_swapped_wrong_end) = 0.583
  [J] mean neighbor sim (k=10) = 0.344
  [Phi_proxy] mean I(mu_hat(t); mu_check(t)) = 1.593 bits

[Q32:P4] Streaming deltas
  mean dM_correct = 0.018
  mean dM_wrong   = -0.300

[Q32:P4] SciFact streaming status: FAIL

[Q32:P4] SciFact streaming + intervention

[Q32:P4] Intervention: replace truth-consistent checks with wrong checks
  P(M_correct_end > M_wrong_end) = 0.575
  z(H0: p=0.5) = 1.643  (n=120)
  mean(M_correct_end) = -3.370
  mean(M_wrong_end)   = -1.973
  mean(M_correct - M_wrong) = -1.397
  [swap_correct] P(M_correct_end > M_swapped_correct_end) = 0.525
  [swap_correct] mean(M_correct_end - M_swapped_correct_end) = 2.295
  [swap_wrong] P(M_correct_end > M_swapped_wrong_end) = 0.542
  [swap_wrong] mean(M_correct_end - M_swapped_wrong_end) = 0.303
  [J] mean neighbor sim (k=10) = 0.348
  [Phi_proxy] mean I(mu_hat(t); mu_check(t)) = 1.547 bits

[Q32:P4] Streaming deltas
  mean dM_correct = -1.974
  mean dM_wrong   = -0.680

[Q32:P4] SciFact streaming status: FAIL

[Q32:STRESS] Summary
  pass_rate = 0.167  (pass_n=1/6)
  min_pair_wins = 0.550
  min_z = 1.095
  min_mean_margin = -2.006
  min_mean_R_correct_end = 35.410
  min_mean_R_wrong_end   = 22.314
  min_mean_logR_correct_end = -5.024
  min_mean_logR_wrong_end   = -3.018
[Q32:STRESS] Wrote LAW/CONTRACTS/_runs/q32_public/datatrail/stress_p3_scifact_neighbor_full_20260109_232034.json

[Q32] PUBLIC BENCHMARK SUMMARY
  - SciFact-Streaming: PASS
  - SciFact-Streaming: FAIL
  - SciFact-Streaming: FAIL
  - SciFact-Streaming: FAIL
  - SciFact-Streaming: FAIL
  - SciFact-Streaming: FAIL
  - SciFact-Streaming-Stress: FAIL
[Q32] EmpiricalMetricReceipt written: LAW/CONTRACTS/_runs/q32_public/datatrail/empirical_receipt_p3_stress_scifact_neighbor_full_20260109_232034.json
[Q32] EmpiricalMetricReceipt sha256: BE4F4370DD1CE442064085DB66FAFE8A42C6773186C42E86FC562CB08BAFA8E4
exit_code=1
